<?xml version="1.0" encoding="UTF-8"?>
<structure xmlns:xsi="http://www.w3.org/2001/XMLSchema-instance"
           xmlns="http://eu.europa.ec.digit.leos.pilot/schema/"
           xsi:schemaLocation="http://eu.europa.ec.digit.leos.pilot/schema/ structure_1.xsd">

    <name>structure_05.xml</name>
    <description>Structure used for Council Explanatory CN Test (new document added by the user structure_05.xml)</description>
    <version>1</version>

    <tocItems>
        <tocItem>
            <aknTag>preface</aknTag>
            <root>true</root>
            <draggable>false</draggable>
            <childrenAllowed>false</childrenAllowed>
            <display>true</display>
            <itemNumber>none</itemNumber>
            <itemHeading>none</itemHeading>
            <itemDescription>true</itemDescription>
            <numberEditable>false</numberEditable>
            <contentDisplayed>false</contentDisplayed>
            <deletable>false</deletable>
            <numWithType>false</numWithType>
            <expandedByDefault>true</expandedByDefault>
            <sameParentAsChild>false</sameParentAsChild>
            <numberingType>NONE</numberingType>
            <editable>false</editable>
        </tocItem>

        <tocItem>
            <aknTag>mainBody</aknTag>
            <root>true</root>
            <draggable>false</draggable>
            <childrenAllowed>true</childrenAllowed>
            <display>true</display>
            <itemNumber>none</itemNumber>
            <itemHeading>none</itemHeading>
            <itemDescription>true</itemDescription>
            <numberEditable>false</numberEditable>
            <contentDisplayed>false</contentDisplayed>
            <deletable>false</deletable>
            <numWithType>false</numWithType>
            <expandedByDefault>true</expandedByDefault>
            <sameParentAsChild>false</sameParentAsChild>
            <numberingType>NONE</numberingType>
            <editable>false</editable>
        </tocItem>

        <tocItem>
            <aknTag>part</aknTag>
            <root>false</root>
            <higherElement>true</higherElement>
            <draggable>true</draggable>
            <childrenAllowed>true</childrenAllowed>
            <display>true</display>
            <itemNumber>mandatory</itemNumber>
            <autoNumbering>false</autoNumbering>
            <itemHeading>mandatory</itemHeading>
            <itemDescription>true</itemDescription>
            <numberEditable>true</numberEditable>
            <contentDisplayed>false</contentDisplayed>
            <deletable>true</deletable>
            <numWithType>true</numWithType>
            <expandedByDefault>true</expandedByDefault>
            <sameParentAsChild>false</sameParentAsChild>
            <numberingType>HIGHER_ELEMENT_NUM</numberingType>
            <editable>false</editable>
            <addSoftAttr>false</addSoftAttr>
            <template><![CDATA[<part xml:id="${id}"><num>${num}</num><heading>${heading}</heading></part>]]></template>
        </tocItem>

        <tocItem>
            <aknTag>title</aknTag>
            <root>false</root>
            <higherElement>true</higherElement>
            <draggable>true</draggable>
            <childrenAllowed>true</childrenAllowed>
            <display>true</display>
            <itemNumber>mandatory</itemNumber>
            <autoNumbering>false</autoNumbering>
            <itemHeading>mandatory</itemHeading>
            <itemDescription>true</itemDescription>
            <numberEditable>true</numberEditable>
            <contentDisplayed>false</contentDisplayed>
            <deletable>true</deletable>
            <numWithType>true</numWithType>
            <expandedByDefault>true</expandedByDefault>
            <sameParentAsChild>false</sameParentAsChild>
            <numberingType>HIGHER_ELEMENT_NUM</numberingType>
            <editable>false</editable>
            <addSoftAttr>false</addSoftAttr>
            <template><![CDATA[<title xml:id="${id}"><num>${num}</num><heading>${heading}</heading></title>]]></template>
        </tocItem>

        <tocItem>
            <aknTag>chapter</aknTag>
            <root>false</root>
            <higherElement>true</higherElement>
            <draggable>true</draggable>
            <childrenAllowed>true</childrenAllowed>
            <display>true</display>
            <itemNumber>mandatory</itemNumber>
            <autoNumbering>false</autoNumbering>
            <itemHeading>mandatory</itemHeading>
            <itemDescription>true</itemDescription>
            <numberEditable>true</numberEditable>
            <contentDisplayed>false</contentDisplayed>
            <deletable>true</deletable>
            <numWithType>true</numWithType>
            <expandedByDefault>true</expandedByDefault>
            <sameParentAsChild>false</sameParentAsChild>
            <numberingType>HIGHER_ELEMENT_NUM</numberingType>
            <editable>false</editable>
            <addSoftAttr>false</addSoftAttr>
            <template><![CDATA[<chapter xml:id="${id}"><num>${num}</num><heading>${heading}</heading></chapter>]]></template>
        </tocItem>

        <tocItem>
            <aknTag>section</aknTag>
            <root>false</root>
            <higherElement>true</higherElement>
            <draggable>true</draggable>
            <childrenAllowed>true</childrenAllowed>
            <display>true</display>
            <itemNumber>mandatory</itemNumber>
            <autoNumbering>false</autoNumbering>
            <itemHeading>mandatory</itemHeading>
            <itemDescription>true</itemDescription>
            <numberEditable>true</numberEditable>
            <contentDisplayed>false</contentDisplayed>
            <deletable>true</deletable>
            <numWithType>true</numWithType>
            <expandedByDefault>true</expandedByDefault>
            <sameParentAsChild>false</sameParentAsChild>
            <numberingType>HIGHER_ELEMENT_NUM</numberingType>
            <editable>false</editable>
            <addSoftAttr>false</addSoftAttr>
            <template><![CDATA[<section xml:id="${id}"><num>${num}</num><heading>${heading}</heading></section>]]></template>
        </tocItem>

        <tocItem>
            <aknTag>division</aknTag>
            <root>false</root>
            <higherElement>false</higherElement>
            <draggable>true</draggable>
            <childrenAllowed>false</childrenAllowed>
            <display>true</display>
            <itemNumber>mandatory</itemNumber>
            <autoNumbering>true</autoNumbering>
            <itemHeading>mandatory</itemHeading>
            <itemDescription>false</itemDescription>
            <numberEditable>true</numberEditable>
            <contentDisplayed>false</contentDisplayed>
            <deletable>true</deletable>
            <numWithType>false</numWithType>
            <expandedByDefault>true</expandedByDefault>
            <sameParentAsChild>false</sameParentAsChild>
            <numberingType>DIVISION_NUM</numberingType>
            <editable>true</editable>
            <addSoftAttr>false</addSoftAttr>
            <template><![CDATA[<division xml:id="${id}"><num>${num}</num><heading>${heading}</heading></division>]]></template>
        </tocItem>

        <tocItem>
            <aknTag>num</aknTag>
            <root>false</root>
            <draggable>false</draggable>
            <childrenAllowed>false</childrenAllowed>
            <display>false</display>
            <itemNumber>none</itemNumber>
            <itemHeading>none</itemHeading>
            <itemDescription>false</itemDescription>
            <numberEditable>false</numberEditable>
            <contentDisplayed>false</contentDisplayed>
            <deletable>false</deletable>
            <numWithType>false</numWithType>
            <expandedByDefault>true</expandedByDefault>
            <sameParentAsChild>false</sameParentAsChild>
            <numberingType>ROMAN_UPPER</numberingType>
            <profiles>
                <profile>
                    <elementSelector>division num</elementSelector>
                    <profileName>inlineAknDivisionNum</profileName>
                </profile>
            </profiles>
            <editable>true</editable>
        </tocItem>

        <tocItem>
            <aknTag>heading</aknTag>
            <root>false</root>
            <draggable>false</draggable>
            <childrenAllowed>false</childrenAllowed>
            <display>false</display>
            <itemNumber>none</itemNumber>
            <itemHeading>none</itemHeading>
            <itemDescription>true</itemDescription>
            <numberEditable>false</numberEditable>
            <contentDisplayed>false</contentDisplayed>
            <deletable>false</deletable>
            <numWithType>false</numWithType>
            <expandedByDefault>true</expandedByDefault>
            <sameParentAsChild>false</sameParentAsChild>
            <numberingType>NONE</numberingType>
            <profiles>
                <profile>
                    <elementSelector>division heading</elementSelector>
                    <profileName>inlineAknHeading</profileName>
                </profile>
            </profiles>
            <editable>true</editable>
            <addSoftAttr>false</addSoftAttr>
        </tocItem>

        <tocItem>
            <aknTag>crossHeading</aknTag>
            <root>false</root>
            <draggable>true</draggable>
            <childrenAllowed>false</childrenAllowed>
            <display>true</display>
            <itemNumber>none</itemNumber>
            <itemHeading>none</itemHeading>
            <itemDescription>false</itemDescription>
            <numberEditable>false</numberEditable>
            <contentDisplayed>true</contentDisplayed>
            <deletable>true</deletable>
            <numWithType>false</numWithType>
            <expandedByDefault>true</expandedByDefault>
            <sameParentAsChild>false</sameParentAsChild>